Text,Sentiment,Timestamp,User,Platform,Hashtags,Retweets,Likes,Country,Year,Month,Day,Hour
"at a u2 concert, the anthemic chords of 'with or without you' create a timeless moment of connection.",Connection,2016-05-15 19:30:00, U2ConnectionSeeker , Instagram , #Connection #U2Anthem ,25,50, Ireland ,2016,5,15,19
"rocking out at a guns n' roses show, the iconic riffs of 'sweet child o' mine' echoing in the night.",Iconic,2018-12-10 22:30:00, GunsNRosesRiffRockstar , Twitter , #Iconic #GNRConcert ,22,45, USA ,2018,12,10,22
"in the crowd of an ariana grande concert, the high notes of 'into you' create a euphoric symphony.",Euphoria,2023-01-22 20:00:00, ArianaEuphoriaChaser , Facebook , #Euphoria #ArianaGrande ,35,70, USA ,2023,1,22,20
"swaying to the reggae vibes of bob marley's tribute concert, each chord a journey to jamaica's soul.",Journey,2020-03-05 18:45:00, MarleyReggaeTraveler , Instagram , #Journey #BobMarleyTribute ,30,60, Jamaica ,2020,3,5,18
"captivated by the spellbinding plot twists, the audience applauds, experiencing a rollercoaster of emotions at the movie premiere.",Excitement,2018-10-12 20:00:00, MovieEnthusiastPremiereAttendee , Twitter , #Excitement #MoviePremiereThrills ,40,80, USA ,2018,10,12,20
"as the credits roll, a profound sense of nostalgia washes over, reminiscent of cherished moments in classic films.",Nostalgia,2019-06-25 22:15:00, FilmLoverNostalgiaSeeker , Instagram , #Nostalgia #ClassicFilmMoments ,35,70, UK ,2019,6,25,22
"streaming the latest web series, the viewer is engrossed in the characters' journey, feeling a sense of connection and empathy.",Engagement,2020-07-08 19:30:00, WebSeriesViewerCharacterConnection , Facebook , #Engagement #WebSeriesJourney ,30,60, Canada ,2020,7,8,19
"at the film festival, the indie filmmaker's creation receives a standing ovation, evoking pride and a sense of accomplishment.",Pride,2017-09-18 21:45:00, IndieFilmmakerFestivalSuccess , Twitter , #Pride #IndieFilmSuccess ,22,45, Australia ,2017,9,18,21
"watching a heartwarming family drama, tears flow freely as the characters overcome challenges, leaving the viewer with a warm glow.",Touched,2021-01-15 18:00:00, DramaEnthusiastHeartwarmingMoments , Instagram , #Touched #FamilyDramaMoments ,28,55, India ,2021,1,15,18
"at the oscars, the actor graciously accepts an award, radiating joy and gratitude for the recognition of their outstanding performance.",Gratitude,2016-02-28 20:30:00, AwardWinningActorOscarsRecipient , Facebook , #Gratitude #OscarWinningMoment ,18,35, USA ,2016,2,28,20
"discovering a hidden gem in the world of documentaries, the viewer is enlightened and inspired, feeling a renewed sense of curiosity.",Inspiration,2022-04-20 17:30:00, DocumentaryEnthusiastHiddenGemFinder , Twitter , #Inspiration #HiddenGemDiscovery ,22,45, France ,2022,4,20,17
"as the movie credits roll, the viewer experiences a mix of awe and contemplation, pondering the deeper meanings woven into the storyline.",Contemplation,2019-11-05 21:15:00, FilmBuffContemplativeViewer , Instagram , #Contemplation #DeepMeanings ,28,55, Germany ,2019,11,5,21
"binge-watching a thrilling crime series, the suspense keeps the viewer on the edge of their seat, creating a rush of adrenaline.",Suspense,2015-07-12 22:00:00, CrimeSeriesEnthusiastThrillSeeker , Facebook , #Suspense #CrimeSeriesThrills ,35,70, Japan ,2015,7,12,22
"as the closing scene unfolds, a sense of satisfaction washes over, completing the cinematic journey with a profound and fulfilling ending.",Satisfaction,2020-09-10 19:45:00, FilmCriticSatisfactionSeeker , Twitter , #Satisfaction #FulfillingEnding ,22,45, Brazil ,2020,9,10,19
"celebrating a historic victory in the world cup, the nation erupts in joy, united by the triumph of their football team.",Joy,2018-07-15 21:30:00, FootballFanWorldCupCelebration , Instagram , #Joy #WorldCupTriumph ,40,80, Brazil ,2018,7,15,21
"at the olympics, the athlete's perseverance shines through, earning a gold medal and inspiring a generation with their remarkable achievement.",Inspiration,2020-08-08 19:45:00, OlympicsEnthusiastGoldMedalWinner , Twitter , #Inspiration #OlympicAchievement ,35,70, USA ,2020,8,8,19
"in the cricket championship, a nail-biting finish leaves fans on the edge of their seats, experiencing a rollercoaster of emotions.",Excitement,2019-06-25 22:15:00, CricketFanChampionshipThrills , Facebook , #Excitement #CricketChampionship ,30,60, India ,2019,6,25,22
"witnessing a record-breaking marathon, spectators are filled with awe and admiration for the endurance and dedication of the runners.",Admiration,2021-11-07 17:30:00, MarathonSpectatorRecordBreaking , Instagram , #Admiration #MarathonRecords ,22,45, Kenya ,2021,11,7,17
"in the tennis grand slam, a fierce rivalry unfolds, captivating fans with a display of skill and sportsmanship on the world stage.",Captivation,2017-09-10 20:15:00, TennisEnthusiastGrandSlamDrama , Twitter , #Captivation #TennisRivalry ,28,55, UK ,2017,9,10,20
"cheering for the underdog in the basketball finals, the crowd erupts in applause as the team defies odds to claim the championship title.",Triumph,2022-06-20 21:00:00, BasketballFanUnderdogTriumph , Facebook , #Triumph #BasketballFinals ,18,35, USA ,2022,6,20,21
"at the golf tournament, the golfer's precision and focus lead to a stunning victory, leaving spectators in awe of their exceptional skill.",Awe,2016-04-10 18:30:00, GolfEnthusiastPrecisionVictory , Instagram , #Awe #GolfVictory ,22,45, Scotland ,2016,4,10,18
"experiencing the thrill of a high-speed formula 1 race, fans are on the edge of their seats as drivers compete for the championship.",Thrill,2019-11-24 19:45:00, F1FanHighSpeedRaceExcitement , Twitter , #Thrill #Formula1Championship ,28,55, Germany ,2019,11,24,19
"in the cycling world championship, the climber conquers challenging terrains, symbolizing determination and achievement against all odds.",Determination,2015-09-28 22:30:00, CyclingEnthusiastWorldChampion , Facebook , #Determination #CyclingChampion ,35,70, Italy ,2015,9,28,22
"witnessing a heartwarming comeback in the hockey finals, fans share tears of joy as the team secures a historic victory after adversity.",Heartwarming,2020-12-12 20:00:00, HockeyFanComebackVictory , Instagram , #Heartwarming #HockeyFinalsComeback ,22,45, Canada ,2020,12,12,20
"after a series of defeats, the soccer team faces disappointment, struggling to find the silver lining in a challenging season.",Disappointment,2019-11-02 18:45:00, SoccerFanTeamDefeats , Twitter , #Disappointment #SoccerDefeats ,40,80, Brazil ,2019,11,2,18
"in the tennis tournament, a highly anticipated player experiences a setback, leaving fans in shock and questioning the unforeseen turn of events.",Frustration,2018-07-10 21:15:00, TennisEnthusiastUnexpectedSetback , Instagram , #Frustration #TennisSetback ,35,70, USA ,2018,7,10,21
"facing a defeat in the championship, the boxer reflects on the challenges, vowing to return stronger and more determined in the next bout.",Reflection,2020-09-18 19:30:00, BoxingFanChampionshipDefeat , Facebook , #Reflection #BoxingDefeat ,30,60, UK ,2020,9,18,19
"in the midst of a cycling race, a tire blowout leads to frustration for the cyclist, who valiantly tries to overcome the unexpected obstacle.",Obstacle,2017-05-15 22:00:00, CyclingEnthusiastTireBlowout , Twitter , #Obstacle #CyclingFrustration ,22,45, France ,2017,5,15,22
"the gymnast's unexpected fall during a routine sparks a wave of sympathy from the audience, highlighting the vulnerability of sports.",Sympathy,2021-04-05 20:15:00, GymnasticsFanRoutineFall , Instagram , #Sympathy #GymnasticsFall ,28,55, Japan ,2021,4,5,20
"in the golf tournament, a missed crucial putt results in defeat, causing the golfer to reflect on the pressure of high-stakes competition.",Pressure,2016-08-20 18:30:00, GolfEnthusiastMissedPutt , Facebook , #Pressure #GolfDefeat ,18,35, USA ,2016,8,20,18
"experiencing a series of losses in the basketball season, the team grapples with frustration, determined to turn the tide with renewed effort.",Renewed effort,2019-02-12 19:45:00, BasketballFanTeamLosses , Twitter , #RenewedEffort #BasketballStruggles ,22,45, Canada ,2019,2,12,19
"despite meticulous training, the swimmer faces disappointment as a split-second miscalculation costs them the lead in a crucial race.",Miscalculation,2015-06-28 20:00:00, SwimmingEnthusiastRaceSetback , Instagram , #Miscalculation #SwimmingDisappointment ,28,55, Australia ,2015,6,28,20
"the weightlifter's failed attempt at a personal record results in frustration, highlighting the challenging nature of pushing physical limits.",Challenge,2022-01-08 21:30:00, WeightliftingFanFailedRecord , Facebook , #Challenge #WeightliftingFailure ,35,70, Germany ,2022,1,8,21
"in the midst of a soccer match, an unexpected own goal creates a moment of despair for the player, as teammates console and encourage them.",Despair,2018-12-15 20:15:00, SoccerPlayerOwnGoalMoment , Twitter , #Despair #OwnGoal ,22,45, Spain ,2018,12,15,20
"in the serene beauty of a sunset, nature unfolds a canvas of colors, evoking a sense of tranquility and wonder.",Tranquility,2021-07-10 19:00:00, NatureEnthusiastSunsetWonder , Instagram , #Tranquility #SunsetBeauty ,40,80, Canada ,2021,7,10,19
"embarking on a spontaneous road trip, the traveler discovers hidden gems, creating memories that will be cherished for a lifetime.",Adventure,2019-09-28 20:30:00, TravelEnthusiastRoadTripDiscovery , Twitter , #Adventure #RoadTripMemories ,35,70, USA ,2019,9,28,20
"amidst the bustling city, a quiet café becomes a sanctuary for reflection, where a cup of coffee brings solace to the wandering mind.",Solace,2022-03-15 18:45:00, UrbanExplorerCafeSolitude , Facebook , #Solace #CafeReflection ,30,60, France ,2022,3,15,18
"exploring the vibrant street art of a cultural neighborhood, each mural tells a story, infusing the city with creativity and expression.",Creativity,2017-11-05 21:15:00, ArtEnthusiastStreetArtExploration , Instagram , #Creativity #StreetArtVibes ,22,45, Brazil ,2017,11,5,21
"in the world of science, a breakthrough discovery unfolds, pushing the boundaries of knowledge and opening new frontiers of exploration.",Breakthrough,2020-05-20 16:30:00, ScienceEnthusiastDiscoveryMoment , Twitter , #Breakthrough #ScientificDiscovery ,28,55, Germany ,2020,5,20,16
"connecting with the melody of a live orchestra, the music enthusiast experiences a symphony that resonates deep within the soul.",Harmony,2016-08-22 19:45:00, MusicLoverLiveOrchestraExperience , Facebook , #Harmony #OrchestraMelody ,18,35, UK ,2016,8,22,19
"embracing the aroma of freshly baked bread, the home chef finds joy in the art of baking, creating delicious memories for loved ones.",Joy in baking,2023-04-10 17:15:00, HomeBakerDeliciousMemories , Instagram , #JoyInBaking #HomemadeDelights ,22,45, India ,2023,4,10,17
"wandering through a historical museum, the history enthusiast becomes immersed in the tales of the past, envisioning bygone eras.",Envisioning history,2015-12-18 18:00:00, HistoryBuffMuseumExploration , Twitter , #EnvisioningHistory #MuseumTales ,28,55, Italy ,2015,12,18,18
"in the realm of literature, a captivating novel transports the reader to distant lands, weaving a tapestry of imagination and escape.",Imagination,2021-10-08 20:30:00, BookwormCaptivatingNovelEscape , Facebook , #Imagination #LiteraryEscape ,35,70, Japan ,2021,10,8,20
"capturing the essence of a bustling market, the photographer freezes moments in time, each frame telling a unique and vibrant story.",Vibrancy,2019-03-22 21:45:00, PhotographyEnthusiastMarketMoments , Instagram , #Vibrancy #MarketStories ,22,45, Australia ,2019,3,22,21
"underneath the city lights, the dancer expresses emotions through graceful movements, creating a mesmerizing performance under the night sky.",Mesmerizing,2018-06-15 22:00:00, DanceEnthusiastCityNightPerformance , Twitter , #Mesmerizing #NightDancePerformance ,40,80, USA ,2018,6,15,22
"in the heart of a bustling market, the street food connoisseur indulges in a culinary adventure, savoring diverse flavors and aromas.",Culinary adventure,2019-08-28 19:30:00, FoodieMarketStreetFoodExploration , Instagram , #CulinaryAdventure #StreetFoodDelights ,35,70, Thailand ,2019,8,28,19
"as the first snowflake descends, the winter enthusiast eagerly prepares for a season of frosty delights, anticipating the magic of snow-covered landscapes.",Winter magic,2022-12-01 17:45:00, SnowLoverWinterEnthusiast , Facebook , #WinterMagic #SnowyLandscapes ,30,60, Canada ,2022,12,1,17
"amidst the pages of a captivating mystery novel, the reader unravels clues and secrets, experiencing a thrilling journey of suspense and revelation.",Thrilling journey,2017-04-10 21:15:00, MysteryBookwormSuspensefulRead , Twitter , #ThrillingJourney #MysteryNovel ,22,45, UK ,2017,4,10,21
"surrounded by the vibrant colors of a flower garden, the gardener nurtures blossoms, finding joy in the beauty of nature's ever-changing canvas.",Nature's beauty,2020-05-15 18:30:00, GardeningEnthusiastFlowerGarden , Instagram , #NaturesBeauty #FloralJoy ,28,55, Australia ,2020,5,15,18
"at the astronomy observatory, the stargazer marvels at the vastness of the cosmos, contemplating the mysteries hidden within the celestial expanse.",Celestial wonder,2016-09-22 20:00:00, AstronomyEnthusiastStargazing , Facebook , #CelestialWonder #Stargazing ,18,35, USA ,2016,9,22,20
"engulfed in the aroma of freshly brewed coffee, the writer finds inspiration in every sip, embarking on a journey of creativity and prose.",Creative inspiration,2023-02-12 19:45:00, CoffeeLoverWritersRetreat , Twitter , #CreativeInspiration #CoffeeJourney ,22,45, France ,2023,2,12,19
"in the realm of fashion, the designer unveils a collection that tells a story, blending innovation and tradition on the runway of creativity.",Runway creativity,2015-11-10 21:00:00, FashionEnthusiastDesignerShowcase , Instagram , #RunwayCreativity #FashionInnovation ,28,55, Italy ,2015,11,10,21
"as the waves crash against the shore, the surfer embraces the thrill of riding the ocean's energy, capturing the essence of freedom in each wave.",Ocean's freedom,2021-07-20 18:15:00, SurfingEnthusiastWaveRider , Facebook , #OceansFreedom #SurfingThrills ,22,45, Brazil ,2021,7,20,18
"exploring the historical architecture of an ancient city, the traveler is transported to a bygone era, where each monument whispers tales of the past.",Whispers of the past,2019-04-18 20:30:00, HistoryExplorerAncientCityTour , Twitter , #WhispersOfThePast #HistoricalTour ,35,70, Greece ,2019,4,18,20
successfully avoided eye contact with my crush in the hallway. mission accomplished. #teencrush #stealthmode,Excitement,2023-05-20 19:45:00, CrushAvoider , Twitter , #CrushStruggles #AvoidingEyeContact ,15,30, USA,2023,5,20,19
ran out of snacks during a movie marathon. crisis level: emergency! #movienightstruggles #teenproblems,Boredom,2023-05-21 21:00:00, MovieBuff , Instagram , #SnackCrisis #TeenLife ,18,35, Canada,2023,5,21,21
spent an hour choosing the perfect filter for a selfie. the struggle for that instagram aesthetic is real. #selfiequeen #teenvibes,Joy,2023-05-22 14:30:00, SelfieAddict , Facebook , #SelfieStruggle #TeenConfessions ,22,45, UK,2023,5,22,14
lost my headphones again. how do they vanish into thin air? #headphonemystery #teenlife,Frustration,2023-05-23 16:45:00, AudioExplorer , Twitter , #TeenProblems #LostHeadphones ,20,40, USA,2023,5,23,16
decided to study for exams but ended up making memes about studying instead. procrastination level: expert. #procrastinationnation #teenconfessions,Surprise,2023-05-24 13:15:00, MemeCreator , Instagram , #StudyingMemes #TeenLife ,25,50, Canada,2023,5,24,13
"got dressed for the day, then remembered it's saturday. oops. #weekendvibes #teenstruggles",Indifference,2023-05-25 19:00:00, FashionBlunder , Facebook , #WeekendOops #TeenFashion ,20,40, USA,2023,5,25,19
survived a group project without any drama. miracles do happen. #groupprojectsuccess #teenachievements,Satisfaction,2023-05-26 14:20:00, GroupGenius , Twitter , #TeenSuccess #ProjectMiracle ,28,55, UK,2023,5,26,14
"entered the kitchen with the intention to cook. left with a bag of chips. cooking is overrated, anyway. #masterchefintraining #teenhumor",Disgust,2023-05-27 21:15:00, ChipExplorer , Instagram , #TeenChef #CookingFail ,22,45, Canada,2023,5,27,21
"staring at the clock in class, waiting for the bell to ring like it's the most exciting event of the day. #classcountdown #teenlife",Surprise,2023-05-28 12:00:00, ExcitementSeeker , Facebook , #ClassEvent #TeenExcitement ,18,35, USA,2023,5,28,12
"discovered a new book series and spent the whole night reading. who needs sleep, anyway? #bookwormlife #latenightreading",Joy,2023-05-29 23:30:00, NightReader , Twitter , #BookDiscoveries #TeenReading ,30,60, UK,2023,5,29,23
"bought a new video game, played for hours, forgot to eat. the ultimate gaming session. #gamerlife #nofoodgaming",Excitement,2023-05-30 20:45:00, GamingEnthusiast , Instagram , #GameOn #TeenGamer ,22,45, USA,2023,5,30,20
spent the day binge-watching a new series. productivity level: zero. #lazyday #tvseriesmarathon,Joy,2023-05-31 15:30:00, LazyWatcher , Facebook , #BingeWatchDay #TeenLife ,35,70, Canada,2023,5,31,15
caught up on the latest fashion trends and now planning a shopping spree. #fashionista #trendyteen,Excitement,2023-06-01 18:00:00, TrendExplorer , Twitter , #FashionGoals #TeenStyle ,20,40, USA,2023,6,1,18
decided to learn a new instrument. day one: still trying to figure out how to hold it. #musicnovice #learningjourney,Frustration,2023-06-02 14:30:00, MusicalExplorer , Instagram , #InstrumentLearning #TeenMusic ,28,55, UK,2023,6,2,14
spent hours creating the perfect playlist for every mood. music is my therapy. #playlistmaker #teenmusiclover,Joy,2023-06-03 21:15:00, MusicAficionado , Facebook , #MusicTherapy #TeenPlaylist ,22,45, Canada,2023,6,3,21
successfully cooked a gourmet meal for the family. chef skills unlocked! #chefmode #teenchef,Pride,2023-06-04 19:30:00, HomeChef , Twitter , #CookingSuccess #TeenCook ,25,50, USA,2023,6,4,19
spontaneously booked a weekend getaway. adventure awaits! #travelbug #weekendescape,Excitement,2023-06-05 10:00:00, AdventureSeeker , Instagram , #GetawayGoals #TeenTravel ,18,35, UK,2023,6,5,10
attended a concert and danced the night away. music is the heartbeat of life. #concertvibes #danceallnight,Joy,2023-06-06 22:30:00, DanceEnthusiast , Facebook , #MusicMagic #TeenConcert ,28,55, Canada,2023,6,6,22
rediscovered childhood cartoons and had a nostalgia-filled marathon. #cartoonnostalgia #teenmemories,Joy,2023-06-07 12:45:00, NostalgiaExplorer , Twitter , #ChildhoodMemories #TeenCartoons ,22,45, USA,2023,6,7,12
embarked on a diy home decor project. let's hope it turns out better than last time. #diyadventure #teenhomedecor,Excitement,2023-06-08 16:00:00, HomeDecorator , Instagram , #DIYGoals #TeenCreative ,35,70, UK,2023,6,8,16
"spent the afternoon at a museum, pretending to be cultured. art enthusiast in the making. #museumday #teenartlover",Curiosity,2023-06-09 14:00:00, ArtExplorer , Facebook , #CulturalDay #TeenCuriosity ,20,40, USA,2023,6,9,14
started a blog about random thoughts and musings. blogging is the new diary. #bloggerlife #teenblogger,Curiosity,2023-06-10 17:30:00, ThoughtfulBlogger , Twitter , #BloggingJourney #TeenThoughts ,30,60, Canada,2023,6,10,17
relishing a peaceful afternoon with a classic novel. quiet moments are the best moments. #booklover #peacefulafternoon,Contentment,2023-06-11 15:30:00, NovelEnthusiast , Instagram , #QuietMoments #BookishEscape ,35,70, USA,2023,6,11,15
"reflecting on a lifetime of memories, each wrinkle tells a story. embracing the beauty of aging. #lifereflections #beautyinaging",Gratitude,2023-06-12 18:00:00, WiseSoul , Twitter , #AgingGracefully #Memories ,28,55, UK,2023,6,12,18
exploring the world of digital art. it's never too late to discover new passions. #digitalartistry #latebloomer,Curiosity,2023-06-13 14:45:00, ArtAdventurer , Facebook , #ArtDiscovery #SeniorArtist ,22,45, Canada,2023,6,13,14
savoring the flavors of a home-cooked meal. simple joys are the heart of happiness. #homecooking #simplejoys,Contentment,2023-06-14 19:30:00, HomeChefSenior , Instagram , #HappinessInFood #SeniorLife ,25,50, USA,2023,6,14,19
embarking on a journey of learning a new language. the mind stays young with every new word. #languagelearning #nevertoolate,Curiosity,2023-06-15 12:15:00, LinguisticExplorer , Twitter , #MindEnrichment #SeniorLearning ,30,60, UK,2023,6,15,12
"attended a classical music concert, feeling the timeless melodies resonate. music transcends generations. #classicalmusic #timelessmelodies",Joy,2023-06-16 21:45:00, MusicConnoisseur , Facebook , #MusicLover #SeniorConcert ,18,35, Canada,2023,6,16,21
capturing the beauty of nature through photography. every snapshot is a treasure. #naturephotography #seniorphotographer,Joy,2023-06-17 15:00:00, PhotographySenior , Instagram , #NatureCapture #SeniorMoments ,35,70, USA,2023,6,17,15
"reconnecting with old friends over a cup of tea. friendship, the true essence of companionship. #oldfriends #companionship",Contentment,2023-06-18 11:30:00, TeaTimeSenior , Twitter , #FriendshipGoals #SeniorBonding ,28,55, UK,2023,6,18,11
"embarked on a road trip to revisit cherished places from the past. nostalgia, the ultimate travel companion. #roadtrip #nostalgiatour",Joy,2023-06-19 16:30:00, RoadTripSenior , Facebook , #CherishedPlaces #SeniorTravel ,22,45, Canada,2023,6,19,16
"joined a community choir, harmonizing with fellow voices. music creates bonds that withstand time. #communitychoir #harmonyinaging",Joy,2023-06-20 14:20:00, ChoirEnthusiast , Instagram , #MusicHarmony #SeniorVoices ,20,40, USA,2023,6,20,14
"exploring the art of meditation, finding tranquility in the stillness of the mind. #meditationjourney #tranquilmind",Contentment,2023-06-21 19:00:00, MeditationSenior , Twitter , #MindfulLiving #SeniorCalm ,18,35, UK,2023,6,21,19
"taking a stroll in the garden, appreciating the beauty of blooming flowers. nature's wonders never cease. #gardenwalk #floralbeauty",Contentment,2023-06-22 13:45:00, GardenEnthusiast , Facebook , #NatureWonders #SeniorGarden ,25,50, USA,2023,6,22,13
"sipping on a favorite vintage wine, each sip telling a story of the years gone by. cheers to a life well-lived. #winelover #vintagecheers",Contentment,2023-06-23 18:45:00, WineConnoisseur , Instagram , #LifeWellLived #SeniorWine ,28,55, UK,2023,6,23,18
"participated in a community art class, unleashing creativity in the golden years. art has no age limit. #artclass #seniorartistry",Joy,2023-06-24 16:15:00, ArtisticSenior , Twitter , #CreativityAtAnyAge #SeniorCreativity ,22,45, Canada,2023,6,24,16
"embarking on a journey of writing a memoir, documenting a lifetime of experiences. every story matters. #memoirwriting #seniorstories",Gratitude,2023-06-25 20:30:00, MemoiristSenior , Facebook , #LifetimeExperiences #SeniorMemoir ,35,70, USA,2023,6,25,20
"attended a lecture on history, always fascinated by the lessons from the past. learning is a lifelong adventure. #historylecture #seniorlearning",Curiosity,2023-06-26 14:00:00, HistoryEnthusiast , Instagram , #LifetimeAdventure #SeniorCuriosity ,30,60, UK,2023,6,26,14
"rediscovered the joy of cooking traditional family recipes. the kitchen, a place of cherished memories. #familyrecipes #seniorcooking",Contentment,2023-06-27 17:45:00, FamilyChefSenior , Twitter , #KitchenMemories #SeniorCulinary ,20,40, USA,2023,6,27,17
"joined a nature photography club, capturing the beauty of the great outdoors. every click is a connection to nature. #naturephotography #seniorphotographer",Joy,2023-06-28 22:15:00, NaturePhotographySenior , Facebook , #OutdoorBeauty #SeniorClicks ,18,35, UK,2023,6,28,22
"attended a jazz concert and swayed to the rhythm of timeless tunes. music, a constant companion in the golden years. #jazzconcert #seniormusic",Joy,2023-06-29 16:30:00, JazzMusicLover , Instagram , #TimelessTunes #SeniorJazz ,25,50, USA,2023,6,29,16
"joined a writing group, penning down thoughts and reflections. writing, a journey into the depths of the soul. #writinggroup #seniorwriter",Gratitude,2023-06-30 19:30:00, SeniorWordsmith , Twitter , #SoulfulWriting #SeniorReflections ,28,55, UK,2023,6,30,19
"embarked on a solo travel adventure, discovering the beauty of new places at my own pace. #solotravel #seniorexplorer",Excitement,2023-07-01 14:00:00, SoloAdventurer , Instagram , #DiscoverNewPlaces #SeniorTravel ,30,60, USA,2023,7,1,14
"attended a vintage car show, reminiscing about the classics that once ruled the roads. nostalgia in every rev. #vintagecars #classicrides",Joy,2023-07-02 18:30:00, CarEnthusiastSenior , Facebook , #RoadTripDownMemoryLane #SeniorCars ,22,45, UK,2023,7,2,18
"started a community garden, growing not just plants but friendships too. green thumbs unite! #communitygarden #seniorgardener",Joy,2023-07-03 12:45:00, GreenThumbSenior , Twitter , #GardenFriends #SeniorGreenThumb ,28,55, Canada,2023,7,3,12
"hosted a family dinner, where laughter echoed louder than the clinking of utensils. family, the heart of happiness. #familydinner #seniorhost",Contentment,2023-07-04 17:00:00, FamilyHostSenior , Instagram , #HeartwarmingMoments #SeniorFamily ,35,70, USA,2023,7,4,17
"enrolled in a dance class for seniors, moving to the rhythm of life. age is just a number on the dance floor. #danceclass #seniordancer",Joy,2023-07-05 20:15:00, DanceEnthusiastSenior , Twitter , #DanceLife #SeniorMoves ,18,35, UK,2023,7,5,20
"visited an art gallery, appreciating the brushstrokes that tell tales of creativity. art, an eternal companion. #artgallery #seniorartlover",Joy,2023-07-06 14:30:00, ArtGalleryVisitor , Facebook , #CreativeExpressions #SeniorArt ,25,50, USA,2023,7,6,14
